,datetime,article_text
48,2024-07-25 12:20:00,"В четверг, 25 июля, на мировых фондовых площадках сохраняется негативная динамика после сильного снижения накануне, спровоцированного распродажей акций технологических компаний США из-за не совсем убедительных отчетностей Tesla и Alphabet, двух представителей так называемой «Великолепной семерки». Надо отметить, что бумаги американских техгигантов существенно выросли с начала этого года и торгуются с завышенными мультипликаторами. В связи с этим инвесторы и аналитики предъявляют повышенные требования к их финансовым отчетам, и даже относительно небольшие недостатки могут вызывать резко негативную реакцию. 
Основные фондовые индексы США в среду просели на 1,3-3,6%, причем для S&P 500 и Nasdaq падение стало самым существенным с 2022 г. Сегодня фьючерсы на американские индексы торгуется в умеренном минусе, инвесторы ждут данных по динамике ВВП Штатов во 2-м квартале. Рынки азиатских стран заметно снижаются вслед за Уолл-стрит, при этом трейдеры также оценивают региональные новости. Народный банк Китая провел незапланированное заседание, по итогам которого опустил ставку по кредитам сроком на год, выдаваемым в рамках программы среднесрочного кредитования (MLF), до 2,3% годовых с 2,5%. Снижение ставки стало первым за год. Тем временем ВВП Южной Кореи во 2-м квартале, по предварительным официальным данным, сократился на 0,2% к/к, хотя ожидалось его повышение на 0,1%. С существенного снижения началась торговая сессия в Европе.
По состоянию на 11:50 МСК индексы Мосбиржи и РТС снизились на 0,97%. Сводный европейский фондовый индикатор Stoxx 600 ослаб на 1,32%. Китайский CSI 300 понизился на 0,55%, гонконгский Hang Seng – упал на 1,72%. Фьючерс на S&P 500 уменьшился на 0,34%, доходность 10-летних казначейских облигаций США опустилась на 5 б.п. до 4,23%. Стоимость сентябрьских фьючерсов на нефть Brent снизилась на 0,49% до $81,3 за баррель.
В США в среду акции Alphabet, материнской структуры Google, снизились в цене на 5%. Компания отчиталась о росте выручки и прибыли во 2-м квартале с превышением прогнозов, однако инвесторы, по-видимому, негативно восприняли заметное увеличение ее капвложений и более слабый, чем ожидалось, рост рекламных доходов сервиса YouTube. Стоимость акций Tesla упала на 12,3% в связи с тем, что скорректированная прибыль на акцию компании во 2-м квартале оказалась существенно ниже среднего прогноза аналитиков, хотя выручка и выросла до нового рекорда. «За компанию» ощутимо подешевели акции других ведущих техкомпаний – Apple (-2,9%), входящих в состав стратегии «US. Сбалансированная», Microsoft (-3,6%), NVIDIA (-6,8%), Amazon (-3%).
На торгах в Гонконге лидерами снижения стали акции интернет-компании Meituan (-5,5%), горнодобывающей компании Zijin Mining Group (-5,2%), оператора связи China Unicom Hong Kong (-5,1%), нефтяников CNOOC (-4,3%) и PetroChina (-4,2%), производителя ПК Lenovo Group (-3,7%).
Между тем в Европе стоимость акций британской Unilever, одного из крупнейших в мире производителей продуктов питания и товаров повседневного спроса, подскочила на 6,1%, поскольку компания в 1-м полугодии нарастила сильнее ожиданий выручку и скорректированную прибыль, а также повысила размер квартального дивиденда. 
Российские фондовые индикаторы снижаются в четверг после заметного повышения в предыдущие несколько торговых сессий. Давление на отечественные акции оказывают резкое ухудшение конъюнктуры на зарубежных фондовых площадках и продолжающееся снижение цен на нефть. Кроме того, поводом для частичной фиксации прибыли могло стать приближение завтрашнего заседание Банка России, на котором ожидается существенное повышение ключевой ставки. Также инвесторы оценивают отдельные внутренние корпоративные новости.
Лидерами снижения к середине дня стали бумаги «Сургутнефтегаза» (ао -2%), «ВТБ» (-1,8%), «Solidcore» (-1,6%), «Полюса» (-1,4%), «Fix Price» (-1,2%), «Мосбиржи» (-1,1%), «Татнефти» (ао -1,1%), «Глобалтранса» (-1,1%). В умеренном плюсе между тем торговались акции «Интер РАО» (+0,4%), «МТС» (+0,3%), «Русала» (+0,3%.
Нефтяник «Газпром нефть» отчитался о росте выручки в 1-м полугодии по МСФО на 30,1% г/г до 2,02 трлн руб. При этом скорректированная EBITDA повысилась на 12% до 704,1 млрд руб., чистая прибыль – на 7,9% до 328,5 млрд руб. Акции компании подорожали на 1,5%.
Тем временем металлург «ММК» сообщил о росте выручки во 2-м квартале на 16,5 к/к до 224,8 млрд руб. При этом показатель EBITDA поднялся на 20% до 50,6 млрд руб., а свободный денежный поток составил 19,9 млрд руб. против 8 млрд руб. в 1-м квартале. Совет директоров компании также рекомендовал выплатить за 1-е полугодие дивиденды в размере 2,494 руб. на акцию. Стоимость бумаг «ММК» тем не менее просела на 1%.
Техническая картина
Индекс Мосбиржи
С точки зрения теханализа на дневном графике индекс Мосбиржи в рамках отскока закрепился выше уровня 3000 пунктов, а также приблизился к верхней границе локального нисходящего канала. Ожидаем тестирования данной линии в ближайшие дни, и в случае ее пробития целью дальнейшего повышения станет район 3170-3200 пунктов.
S&P 500
На дневном графике S&P 500 опустился к нижней границе среднесрочного восходящего клина, рядом с которой также проходит 50-дневная скользящая средняя. Ожидаем некоторого периода консолидации или небольшого отскока. В случае же выхода индекса из фигуры вниз ближайшей целью дальнейшего снижения станет отметка 5260 пунктов.
Euro STOXX 600
На дневном графике индекс STOXX 600 вышел вниз из локального треугольника. Ожидаем продолжения снижения в рамках отработки фигуры, ближайшая цель – 495 пунктов.
CSI 300
На дневном графике CSI 300 опустился к уровню поддержки 3400 пунктов. Индекс выглядит локально перепроданным, в связи с чем можно рассчитывать на формирование отскока с целью на 50-дневной скользящей средней, проходящей вблизи 3530 пунктов.
* Сообщение носит информационный характер, не является индивидуальной инвестиционной рекомендацией или предложением приобрести упомянутые ценные бумаги. Приобретение иностранных ценных бумаг связано с дополнительными рисками."
49,2024-07-25 10:15:00,"Российский рынок открыл торги падением в четверг, 25 июля. Индекс МосБиржи в первые минуты в минусе на 0,4%, до 3039,49 пункта, индекс РТС снижается на 0,4%, до 1106,34 пункта.
В лидерах роста находятся «префы» банка «Санкт-Петербург» (+0,52%) - сегодня набсовет кредитной организации рассмотрит вопрос обратного выкупа акций. Котировки Qiwi растут на 5,56%, МТС - на 0,88%, а «Интер РАО» - на 0,47%. Сегодня утром последняя представила отчет по РСБУ, согласно которой чистая прибыль компании в первом полугодии составила 20 млрд рублей. Акции «Газпром нефти» также растут после публикации отчета - по итогам первой половины года чистая прибыль компании по МСФО достигла 328,5 млрд рублей.
Хуже рынка выглядят бумаги «М.Видео», которые теряют 2,94% после сильного роста днем ранее (+13,77%). Вчера стало известно, что мажоритарным акционером компании стал ее гендиректор Билан Ужахов. Акции ММК теряют 0,54% - совет директоров комбината рекомендовал 2,494 рубля на акцию в виде дивидендов за первую половину 2024 года. Также в минусе бумаги ЛСР на 1,09% и ВТБ на 1,08%.
На сырьевом рынке цены на нефть продолжают быть в минусе. Сентябрьский фьючерс на Brent падает на 0,77%, до $81,08 за баррель, контракт на Light с поставкой в августе теряет 0,72%, до $77,03 за «бочку».
Рубль укрепляется к юаню на Московской бирже на 0,5%, до отметки 11,75. Ближайший фьючерс на курс доллара (Si) в минусе на 0,37%, до 86,56 рубля за доллар. На межбанковском валютном рынке доллар находится на отметке 86,18, евро - 92,86.
Станьте совладельцем успешных компаний. Инвестируйте в акции российских и мировых гигантов из разных секторов на Московской, NYSE, NASDAQ и Гонконгской биржах. Открыть брокерский счет дистанционно за 3 минуты.
К 10:13 мск котировки «М.Видео» снижаются на 3,18%, до отметки 161,6 рубля за акцию, свидетельствуют данные торгов."
50,2024-07-25 10:11:00,"Чистая прибыль «Газпром нефти», относящаяся к акционерам компании, за 1 полугодие по МСФО выросла на 7,9% по сравнению с аналогичным периодом прошлого года и составила 328,5 млрд рублей, сообщила компания.
Выручка увеличилась на 30,1%, до 2 трлн рублей, скорректированная EBITDA – на 11,9%, до 704,1 млрд рублей. Показатель чистый долг / EBITDA остался на уровне 0,45%.
Акции компании сегодня к 10:12 мск повышаются на 0,20%."
51,2024-07-24 09:00:00,"В среду, 24 июля, на Мосбирже начнутся торги акциями МКПАО «Яндекс». Компания планировала к этому времени завершить все необходимые расчеты по биржевым и внебиржевым заявкам на обмен акций в рамках предложения от ЗПИФ «Консорциум.Первый» — основного владельца МКПАО «Яндекс». Ценные бумаги «Яндекса» получили листинг на Мосбирже в апреле 2024 года. Они войдут в первый котировальный список.
Также в этот день совет директоров ММК проведет заседание, на котором рассмотрит вопрос о дивидендах за 1 полугодие текущего года. Будут рассмотрены вопросы о созыве внеочередного собрания акционеров, о рекомендации собранию по размеру дивидендов, об определении формы и текста бюллетеня для голосования. За 2023 год дивиденды компании были одобрены в размере 2,752 рубля на акцию.
Также в среду «РусГидро» опубликует операционные результаты за 1 полугодие 2024 года. В 1 квартале текущего года группа «РусГидро» увеличила выработку электроэнергии на 7,2%, до 35,8 млрд кВт ч. А за 1 полугодие прошлого года группа снизила выработку электроэнергии на 1,1%, до 71,7 млрд кВт·ч.
Кроме того, 24 июля проведет заседание совет директоров «Газпром нефти», в повестке – вопрос об актуализации ключевых рисков компании и группы по итогам 2023 года и мерах по управлению рисками.
Совет директоров «Россети Центр» рассмотрит три вопроса, в том числе о признании членов совета директоров компании независимыми, о формировании комитета по аудиту совета директоров, рассмотрение отчета о расходовании средств по подготовке и проведению ГОСА. Совет директоров «Россети Московский регион» рассмотрит вопросы о независимости членов СД, о комитетах СД.
Совет директоров «ТНС Энерго» рассмотрит вопрос о досрочном прекращении полномочий и трудового договора генерального директора ПАО ГК «ТНС энерго». Также будет рассмотрен вопрос об избрании гендиректора и об определении лица, уполномоченного осуществлять права и обязанности работодателя в отношении генерального директора.
Минфин 24 июля проведет аукционы по размещению ОФЗ 26248 и 29025.
Росстат, в свою очередь, опубликует данные по инфляции. 
В США президент Джо Байден планирует выступить с обращением к американцам вечером 24 июля по местному времени (3:00 мск 25 июля). Он намерен рассказать, «как завершит работу для американского народа».
Свои отчетности на зарубежных рынках представят Ford, AT&T, IBM, Newmont и NextEra Energy."
52,2024-07-23 17:55:00,"“Газпром нефть” может отчитаться за первое полугодие по МСФО на этой неделе, как мы считаем. Результаты 1П24 могут быть слабее 1П23, но схожи со 2П23.
Ждем выручку за первое полугодие $22.1 млрд (RUB 2.02 трлн), EBITDA — $6.2 млрд (RUB 570 млрд), а чистую прибыль — $3.5 млрд (RUB 320 млрд).
Прибыль “Газпром нефти” в долларах за 1П24, вероятно, не поменяется относительно уровня 2П23 г., но будет ниже, чем в 1П23. Все же мы ждем прибыль гораздо выше типичных исторических уровней. 
Цена нефти марки Brent немного снизилась относительно второго полугодия 2023 г. с $84.3/барр. до $83.4, но Urals, наоборот, подорожала с $70/барр. до $73: это немного компенсировало рост расходов.
За 2015-21 гг. средняя чистая прибыль “Газпром нефти” за полугодие составила $2.1 млрд, EBITDA — $4.4 млрд. То есть мы ждем выручку по-прежнему выше тренда.
Мы сохраняем позитивный взгляд на акции “Газпром нефти”, которые сейчас торгуются на уровне 4x по P/E 2024п/2025п, с 11%-ным дисконтом к историческим уровням.
Прогноз финансовых результатов Газпром нефти за 1П24 по МСФО
Источники: данные компании, оценки БКС Мир инвестиций"
53,2024-07-23 10:45:00,"Российские нефтяные компании открыли сезон поставок на восток по Севморпути (СМП), сообщает “Коммерсант”.
Так, “Газпром нефть” направила первую в сезоне танкерную партию арктической нефти в объеме 38 тысяч тонн со своего Новопортовского месторождения в Китай, пишет издание.
Ожидается, что доставка груза займет менее месяца, что должно сэкономить время по сравнению с альтернативными маршрутами - транспортировкой через Суэцкий канал или вокруг мыса Доброй Надежды. В то же время слабый спрос на Urals со стороны Китая может внести коррективы в планы по отправке этой нефти на восток из портов Балтики по СМП.
“Ъ” также отмечает, что месяц назад по восточному маршруту через Севморпуть была отправлена первая в этом году партия сжиженного газа, это был товар “НОВАТЭКа”, который тоже ушел в Китай."
54,2024-07-23 02:17:00,"АО ""ФИНАМ"" сообщает, что поступила информация от НРД НКО АО о корпоративном действии «Дивиденды в денежной форме»
11.8 Информация об исполнении (о частичном исполнении) эмитентом обязанности по выплате объявленных дивидендов по акциям в денежной форме
Ссылка: Доступно клиентам АО """"ФИНАМ"""". Авторизуйтесь или зарегистрируйтесь для доступа."
55,2024-07-19 09:00:00,"В пятницу, 19 июля, совет директоров ""Газпром нефти"" на заседании актуализирует подходы и критерии формирования портфеля инвестиционных проектов.
Совет директоров ""Россетей"" рассмотрит сводный и консолидированный бизнес-план группы компаний на 2024 год и прогнозные показатели на 2025-2028 годы.
«Совкомфлот» закроет дивидендный реестр."
56,2024-07-19 08:50:00,"Совет директоров ""Газпром нефти"" актуализирует подходы и критерии формирования портфеля инвестиционных проектов."
57,2024-07-17 02:05:00,"АО ""ФИНАМ"" сообщает, что поступила информация от НРД НКО АО о корпоративном действии «Выплата процентов»"
