,datetime,article_text
0,2024-09-30 09:00:00,"В понедельник, 30 сентября, ""Газпром нефть"", ""НОВАТЭК"", ""АЛРОСА"", ""Селигдар"", ""НоваБев"", ""ЕвроТранс"" проведут внеочередные общие собрания акционеров. В повестке - вопрос распределения прибыли, в том числе на дивиденды.
Акционеры Globaltrans рассмотрят параметры оферты к держателям ГДР. Совет директоров предложил выкупить расписки, учитываемые в НРД и «СПБ Банке», по цене 520 рублей за штуку.
""Хэдхантер"" начнет buyback на сумму до 9,61 млрд рублей. Программа продлится до 29 сентября 2025 года.
Заканчивается прием оферт от акционеров Solidcore.
Акции ""ТНС энерго Ростов-на-Дону"", ""ТНС энерго Марий Эл"" последний день торгуются с дивидендом в режиме Т+1.
""Банк Санкт-Петербург"" закроет дивидендный реестр.
Правительство внесет в Госдуму проект бюджета на 2025–2027 годы. На 2025 год прогнозируется рост доходов до 40,296 трлн рублей. Это почти на 12% больше, чем в текущем году. Расходы повысятся до 41,469 трлн руб. Доля ненефтегазовых поступлений в общем объёме вырастет до 73%, заявлял премьер-министр России Михаил Мишустин."
1,2024-09-30 07:10:00,"Внеочередное общее собрание акционеров ""Газпром нефти"" по вопросу распределения прибыли, в том числе на дивиденды, пройдет 30 сентября в заочной форме.
Закрытие реестра акционеров для участия в ВОСА - 6 сентября."
2,2024-09-29 15:20:00,"На фоне ралли в акциях Газпрома, на слухах о возможной отмене дополнительного налога НДПИ уже с 2025 года, обращает на себя внимание коррекция в бумагах Газпром нефти, которая как раз напрямую и связана с позитивными новостями, приходящими в последнее время от материнской компании.
Уверен, вы и без меня прекрасно знаете, что Газпром нефть - это самая настоящая кэш-машина, генерирующая достаточный свободный денежный поток (FCF) для выплаты дивидендов своим акционерам, и это является важным фактором для материнской компании в лице Газпрома, которая после начала СВО столкнулась с серьёзной проблемой сокращения экспорта природного газа и ростом налогового бремени, а потому солидный дивидендный поток от нефтяной дочки сейчас приходится как нельзя кстати!
Если вы вдруг забыли, спешу напомнить, что доля Газпрома в акционерном капитале Газпром нефти составляет внушительные 95,68%, и это позволяет материнской компании снимать практически все дивидендные ""сливки"", оставляя при этом ""жирные остатки"" и миноритариям.
В условиях низкого уровня долговой нагрузки для Газпром нефти нет никаких проблем радовать акционеров дивидендами: показатель NetDebt/EBITDA по состоянию на 30.06.2024 составляет всего 0,45х, что считается весьма низким значением для нефтегазовой отрасли. А если вспомнить ещё и про высокие процентные ставки в экономике, то низкая долговая нагрузка становится значительным конкурентным преимуществом для компании!
Именно поэтому, с молчаливого согласия материнской компании, Газпром нефть в последние годы увеличила норму дивидендных выплат с 50% от ЧП по МСФО до текущих 75% от ЧП по МСФО (сначала по итогам 2023 года, а чуть позже - и за 6m2024). Правда, пока не закрепив эту повышенную норму выплат в своём див. уставе, где по-прежнему предусмотрен ""целевой размер дивидендных выплат не менее 50% от чистой прибыли по МСФО, с учётом корректировок"".
Чего же опасаются акционеры Газпром нефти?
Всё просто: они по всей видимости опасаются, что в связи с ожидаемыми налоговыми послаблениями в отношении Газпрома, необходимость максимально ""доить"" Газпромнефть в плане дивидендов может резко снизиться, и уже сейчас они начинают закладывать в котировки, что текущая норма выплат в размере 75% от ЧП по МСФО у Газпромнефти может и не устоять.
Хотя я не вижу ни одной причины, по которой это должно случиться. Ведь даже с учётом ожидаемых налоговых инициатив, глобальные проблемы для Газпрома фундаментально не решатся в обозримом будущем. И здесь самое время вновь вспомнить, что Газпром, скорее всего, навсегда потерял 75% своего экспорта в Европу, амбициозный проект Сила Сибири-2 откладывается на неопределённое время и никакой определённости и понимания здесь нет, дивидендной коровой компания в перспективе ближайших лет вряд ли станет (в том числе на фоне масштабных капексов, без которых не обойтись), а тут ещё и острую конкуренцию с СПГ нужно активно вести, за место под солнцем на мировом газовом рынке.
Поэтому моё отношение к инвестиционному кейсу Газпром нефти по-прежнему крайне позитивное и нисколько не поменялось за последнее время. Это по-прежнему эмитент №1 в моём портфеле по доле присутствия (3,45%), и я очень рад, что моя ставка на эту историю оказалась абсолютно оправданной!
Ждём полугодовой дивиденд в размере 51,96 руб. на акцию, что по текущим котировкам сулит промежуточную ДД=7,3%, и с если уже сейчас из стоимости акции Газпром нефти вычесть этот дивидендный гэп, то мы получим реальный текущий ценник в районе 650+ руб., что находится в непосредственной близости от 13-месячных минимумов. На покупки не намекаю, но по 550+ руб., где проходит мощная линия поддержки, лично я точно буду грести их как не в себя.
Источник"
3,2024-09-27 09:17:00,"«Газпром нефть» обсуждает возможность строительства сети автозаправочных станций под своим брендом в Узбекистане. Об этом заявил глава компании Александр Дюков в кулуарах Российской энергетической недели.
«Сейчас обсуждаем возможность реализации еще ряда проектов в Узбекистане, включая, в том числе, возможность строительства сети автозаправочных станций под своим брендом», - цитирует «РИА Новости» слова Дюкова. 
Он отметил, что его компания уже работает в Узбекистане и поставляет туда нефть и нефтепродукты. «Кроме того, применяя наши цифровые решения, мы помогли открыть в Узбекистане Центр управления бурением, который позволил значительно сократить сроки и стоимость строительства скважин на месторождениях в республике», - сказал Дюков журналистам. "
4,2024-09-26 09:00:00,"В четверг, 26 сентября, пройдет сразу несколько собраний акционеров компаний. Досрочно прекращать полномочия членов совета директоров и решать другие вопросы будут акционеры “М.видео”, “РУСАЛа”, “АПРИ”, “Белона”. А “Татнефть” проведет повторное ВОСА по дивидендам за 1 полугодие этого года.
Тема дивидендам сегодня актуальна и для акционеров “Ашинского метзавода"", ”“Ростелекома” и “Черкизово”. Акции “Черкизово” 26 сентября последний день торгуются с дивидендами. Дата закрытия реестра акционеров, имеющих право на получение дивидендов, - 29 сентября. Ранее акционеры “Черкизово” утвердили дивиденды за 1 полугодие 2024 года в размере 142,11 рубля. 
Что касается акций “Ростелекома”, то они последний день торгуются с дивидендами. Реестр на их получение закрывается 27 сентября, сообщала компания. Акционеры ранее в сентябре утвердили выплату дивидендов по результатам 2023 года. Выплаты составят 6,06 рубля на обыкновенную акцию и такую же сумму - на привилегированную акцию типа “А”.
Кроме того, в четверг, 26 сентября, акции “Ашинского метзавода” последний день торгуются с дивидендами. Акционерам будет выплачено 77 рублей на акцию, доходность составит 44,8%. В пятницу, 27 сентября, будет дивидендный гэп.
Также в четверг Московская биржа прекратит торги акциями Solidcore и запустит торги акциями МКПАО “Хэдхантер”.
26 сентября пройдет и заседание совета директоров “Газпром нефти”. Компания подведет итоги реализации стратегии цифровой трансформации-2023."
5,2024-09-26 02:22:00,"Совет директоров “Газпром нефти” 26 сентября подведет итоги реализации стратегии цифровой трансформации компании за 2023 год.
“Газпром нефть” - первая нефтяная компания России, которая начала системную цифровую трансформацию своего бизнеса.
“Мы переводим в “цифру” каждый этап работы современного нефтяника: от геологической разведки и бурения огромных многоствольных скважин до процесса переработки нефти и момента, когда она в виде топлива попадает в баки автомобиля, самолета или, например, становится битумом для строительства дорог. Это позволяет лучше понимать потребности каждого клиента и строить на этом работу всех звеньев бизнес-цепочки. Так мы улучшаем наши продукты и сервисы”, - говорят в компании."
